{
  "utr": "1234567890",
  "taxpayerStartDate": "2015-04-21",
  "taxSolvencyStatus": "V",
  "accountingPeriods": [
    {
      "apStartDate": "2018-04-06",
      "apEndDate": "2018-10-05",
      "turnover": 38390
    },
    {
      "apStartDate": "2018-10-06",
      "apEndDate": "2019-04-05",
      "turnover": 2340
    }
  ]
}